{
  "$schema": "https://json-schema.org/draft/2020-12/schema",
  "$id": "https://certification.study/schema/certification.schema.json",
  "title": "Certification Exam JSON Schema",
  "type": "object",
  "additionalProperties": false,
  "required": [
    "version",
    "metadata",
    "questions",
    "glossary"
  ],
  "properties": {
    "version": {
      "type": "string",
      "minLength": 1
    },
    "metadata": {
      "type": "object",
      "additionalProperties": false,
      "required": [
        "examCode",
        "examTitle",
        "provider",
        "description",
        "totalQuestions",
        "createdDate",
        "lastModified",
        "categories"
      ],
      "properties": {
        "examCode": {
          "type": "string",
          "minLength": 1
        },
        "examTitle": {
          "type": "string",
          "minLength": 1
        },
        "provider": {
          "type": "string",
          "minLength": 1
        },
        "description": {
          "type": "string"
        },
        "totalQuestions": {
          "type": "integer",
          "minimum": 1
        },
        "createdDate": {
          "type": "string",
          "format": "date"
        },
        "lastModified": {
          "type": "string",
          "format": "date-time"
        },
        "categories": {
          "type": "object",
          "additionalProperties": {
            "type": "string",
            "minLength": 1
          }
        }
      }
    },
    "questions": {
      "type": "array",
      "minItems": 1,
      "items": {
        "$ref": "#/$defs/question"
      }
    },
    "glossary": {
      "type": "object",
      "additionalProperties": {
        "$ref": "#/$defs/glossaryTerm"
      }
    }
  },
  "$defs": {
    "question": {
      "type": "object",
      "additionalProperties": false,
      "required": [
        "id",
        "categoryRef",
        "difficulty",
        "title",
        "scenario",
        "questionText",
        "choices",
        "correctAnswer",
        "hints",
        "tags"
      ],
      "properties": {
        "id": {
          "type": "integer",
          "minimum": 1
        },
        "categoryRef": {
          "type": "string"
        },
        "difficulty": {
          "type": "string",
          "enum": [
            "basic",
            "intermediate",
            "advanced"
          ]
        },
        "title": {
          "type": "string",
          "minLength": 1
        },
        "scenario": {
          "type": "string"
        },
        "questionText": {
          "type": "string",
          "minLength": 1
        },
        "choices": {
          "type": "array",
          "minItems": 4,
          "maxItems": 4,
          "items": {
            "$ref": "#/$defs/choice"
          }
        },
        "correctAnswer": {
          "type": "string",
          "enum": [
            "A",
            "B",
            "C",
            "D"
          ]
        },
        "hints": {
          "type": "array",
          "minItems": 3,
          "maxItems": 3,
          "items": {
            "$ref": "#/$defs/hint"
          }
        },
        "tags": {
          "type": "array",
          "items": {
            "type": "string",
            "minLength": 1
          },
          "uniqueItems": true
        }
      }
    },
    "choice": {
      "type": "object",
      "additionalProperties": false,
      "required": [
        "letter",
        "text"
      ],
      "properties": {
        "letter": {
          "type": "string",
          "enum": [
            "A",
            "B",
            "C",
            "D"
          ]
        },
        "text": {
          "type": "string",
          "minLength": 1
        }
      }
    },
    "hint": {
      "type": "object",
      "additionalProperties": false,
      "required": [
        "level",
        "label",
        "content"
      ],
      "properties": {
        "level": {
          "type": "integer",
          "minimum": 1,
          "maximum": 3
        },
        "label": {
          "type": "string"
        },
        "content": {
          "type": "string",
          "minLength": 1
        }
      }
    },
    "glossaryTerm": {
      "type": "object",
      "additionalProperties": false,
      "required": [
        "id",
        "category",
        "name",
        "definition",
        "examNote",
        "relatedTerms"
      ],
      "properties": {
        "id": {
          "type": "string",
          "minLength": 1
        },
        "category": {
          "type": "string"
        },
        "name": {
          "type": "string",
          "minLength": 1
        },
        "definition": {
          "type": "string",
          "minLength": 1
        },
        "examNote": {
          "type": "string"
        },
        "relatedTerms": {
          "type": "array",
          "items": {
            "type": "string",
            "minLength": 1
          },
          "uniqueItems": true
        }
      }
    }
  }
}
