{
  "version": "1.0",
  "metadata": {
    "examCode": "TEST-001",
    "examTitle": "Sample Test Exam",
    "provider": "Test Provider",
    "description": "A sample exam for unit testing",
    "totalQuestions": 3,
    "createdDate": "2024-01-01",
    "lastModified": "2024-01-15T00:00:00Z",
    "categories": {
      "cat1": "Category One",
      "cat2": "Category Two"
    }
  },
  "questions": [
    {
      "id": 1,
      "categoryRef": "cat1",
      "difficulty": "basic",
      "title": "Sample Question 1",
      "scenario": "<p>You are configuring a test environment.</p>",
      "questionText": "<p>What is the correct answer?</p>",
      "choices": [
        { "letter": "A", "text": "First option" },
        { "letter": "B", "text": "Second option (correct)" },
        { "letter": "C", "text": "Third option" },
        { "letter": "D", "text": "Fourth option" }
      ],
      "correctAnswer": "B",
      "hints": [
        { "level": 1, "label": "Basic Hint", "content": "This is a level 1 hint." },
        { "level": 2, "label": "Detailed Hint", "content": "This is a level 2 hint with more detail." },
        { "level": 3, "label": "Answer Hint", "content": "The answer is B." }
      ],
      "tags": ["testing", "sample"]
    },
    {
      "id": 2,
      "categoryRef": "cat2",
      "difficulty": "intermediate",
      "title": "Sample Question 2",
      "scenario": "",
      "questionText": "<p>Which option is correct?</p>",
      "choices": [
        { "letter": "A", "text": "Option A (correct)" },
        { "letter": "B", "text": "Option B" },
        { "letter": "C", "text": "Option C" },
        { "letter": "D", "text": "Option D" }
      ],
      "correctAnswer": "A",
      "hints": [
        { "level": 1, "label": "Hint", "content": "Think about option A." },
        { "level": 2, "label": "Level 2", "content": "Consider the first option." },
        { "level": 3, "label": "Level 3", "content": "The answer is A." }
      ],
      "tags": ["intermediate"]
    },
    {
      "id": 3,
      "categoryRef": "cat1",
      "difficulty": "advanced",
      "title": "Sample Question 3",
      "scenario": "",
      "questionText": "<p>Select the best answer.</p>",
      "choices": [
        { "letter": "A", "text": "Wrong" },
        { "letter": "B", "text": "Wrong" },
        { "letter": "C", "text": "Wrong" },
        { "letter": "D", "text": "Correct" }
      ],
      "correctAnswer": "D",
      "hints": [
        { "level": 1, "label": "Hint 1", "content": "It's the last one." },
        { "level": 2, "label": "Level 2", "content": "Look at option D." },
        { "level": 3, "label": "Level 3", "content": "The answer is D." }
      ],
      "tags": ["advanced"]
    }
  ],
  "glossary": {
    "term1": {
      "id": "term1",
      "category": "testing",
      "name": "Test Term",
      "definition": "A term used for testing purposes.",
      "examNote": "Remember this for the exam.",
      "relatedTerms": ["term2"]
    },
    "term2": {
      "id": "term2",
      "category": "testing",
      "name": "Another Term",
      "definition": "Another definition.",
      "examNote": "",
      "relatedTerms": []
    }
  }
}
